C	Չեմ կարծում, որ իրար ծանոթ ենք։	I don’t think we have met.	sakayan unit4 dialogue3
A	Մայրի՜կ, սա Արամն է՝ դասընկերս։ Արա՜մ, ծանոթացի՜ր, մայրս է։	Mother, this is Aram, my classmate. Aram, meet my mother.	sakayan unit4 dialogue3
B	Արամ։ Շատ ուրախ եմ, տիկին։	Aram. Very pleased to meet you,	sakayan unit4 dialogue3
C	Ձեր մասին շատ եմ լսել։ Ուրախ եմ, որ վերջապես [վերչապես] անձամբ եմ ծանոթանում։	I have heard a lot about you. I am happy to meet you in person at last.	sakayan unit4 dialogue3
B	Նմանապես։	Likewise.	sakayan unit4 dialogue3
A	Արա՜մ, արի՜ մյուսներին էլ քեզ ծանոթացնեմ։	Aram, let me introduce you to the others as well.	sakayan unit4 dialogue3
B	Սիրո՛վ, գնանք։	Gladly, let’s go!	sakayan unit4 dialogue3
